Row,Stakeholder Name,Sector,Country,Notes
65,Cesária Évora Music Center (Mindelo),Music (artists, production, venues, education),Cape Verde,"Cultural hub for Cape Verdean music, venue and education center"
131,Marché Dantokpa (Artisan Section),Crafts and artisan products,Benin,"Largest market in West Africa, significant artisan presence"
141,Fondation Centre Songhaï,Performing and visual arts,Benin,"Multi-purpose cultural center with arts education and performance spaces"
150,Nana Wax,Fashion & Design,Benin,"Local Beninese fashion brand using traditional fabrics"
151,Sunny Rose Fashion,Fashion & Design,Benin,"Emerging fashion label specializing in wax print and contemporary African fashion"

